{
  "schema_name": "prism_input",
  "schema_version": "gts.v1",
  "prism_input_id": "prm_in_0001",
  "created_at_utc": "2026-03-13T00:00:00Z",
  "artifact_ref_id": "row_000123",
  "artifact_type": "candidate_row",
  "actor_id": "student_b",
  "mode": "output_refraction",
  "context_bundle_ids": [
    "ctx_0009"
  ],
  "notes": [
    "Candidate row entering prism boundary analysis."
  ]
}